name,market_value_21,world_rank_21,market_value_20,world_rank_20,country,ceo,website,sector,employee_count,annual_revenue,annual_net_income,stock_exchange,stock_category,description
PT SIDOMULYO SELARAS TBK,0.005 Billion USD,,0.005 Billion USD,,Indonesia,,,Industries,,,,Jakarta,,
PT KEDAUNG INDAH CAN TBK,0.004 Billion USD,25525,0.004 Billion USD,25525,Indonesia,,,Consumer Cyclical,,,,Jakarta,,
PT TIRTA MAHAKAM RESOURCES TBK,0.004 Billion USD,,0.004 Billion USD,,Indonesia,,,Basic Materials,,,,Jakarta,,
PT METRO REALTY TBK,0.004 Billion USD,,0.004 Billion USD,,Indonesia,,,Real Estate,,,,Jakarta,,
PT MAGNA INVESTAMA MANDIRI TBK,,,,,Indonesia,,,Financial Services,,,,Jakarta,,
PT COTTONINDO ARIESTA TBK,0.004 Billion USD,25616,0.004 Billion USD,25616,Indonesia,,,Consumer Cyclical; Textile,,,,Jakarta,,
PT FORTUNE INDONESIA TBK,0.005 Billion USD,,0.005 Billion USD,,Indonesia,,,Communication Services; Advertising,,,,Jakarta,,
PT EKA SARI LORENA TRANSPORT TBK,0.005 Billion USD,,0.005 Billion USD,,Indonesia,,,Industries; Railway,,,,Jakarta,,
PT BEKASI ASRI PEMULA TBK,0.002 Billion USD,25921,0.002 Billion USD,25921,Indonesia,,,Real Estate,,,,Jakarta,,
PT HOTEL FITRA INTERNATIONAL TBK,0.004 Billion USD,,0.004 Billion USD,,Indonesia,,,Consumer Cyclical,,,,Jakarta,,
PT PRATAMA ABADI NUSA INDUSTRI TBK,0.003 Billion USD,25707,0.003 Billion USD,25707,Indonesia,,,Consumer Defensive; FMCG; Package Foods,,,,Jakarta,,
PT GUNA TIMUR RAYA TBK,0.005 Billion USD,,0.005 Billion USD,,Indonesia,,,Industries,,,,Jakarta,,
PT DARMI BERSAUDARA TBK,0.004 Billion USD,25528,0.004 Billion USD,25528,Indonesia,,,Basic Materials,,,,Jakarta,,
PT PERDANA KARYA PERKASA TBK,0.002 Billion USD,26089,0.002 Billion USD,26089,Indonesia,,,Industries; Construction,,,,Jakarta,,
PT ICTSI JASA PRIMA TBK,0.003 Billion USD,25695,0.003 Billion USD,25695,Indonesia,,,Industries; Shipping,,,,Jakarta,,
PT NORTHCLIFF CITRANUSA INDONESIA TBK,,,,,Indonesia,,,Communication Services,,,,Jakarta,,
PT ARMADA BERJAYA TRANS TBK,0.003 Billion USD,25775,0.003 Billion USD,25775,Indonesia,,,Industries,,,,Jakarta,,
PT YELOOO INTEGRA DATANET TBK,0.001 Billion USD,26274,0.001 Billion USD,26274,Indonesia,,,Consumer Cyclical,,,,Jakarta,,
PT TANAH LAUT TBK,0.002 Billion USD,26057,0.002 Billion USD,26057,Indonesia,,,Industries; Shipping,,,,Jakarta,,
PT SIWANI MAKMUR TBK,,,,,Indonesia,,,Consumer Cyclical,,,,Jakarta,,
PT NUSANTARA INTI CORPORA TBK,0.001 Billion USD,26283,0.001 Billion USD,26283,Indonesia,,,"Financial Services; Stock Markets, Trading, Capital Markets",,,,Jakarta,,
